created_at,screen_name,text
2015,AleafA,Didnt manage to stopped by.. but on our way to our hostel we passed by the road. It was beautiful. Should go there next timee for a photoshoot
2014,Darnel-HDI,Jalan Braga was famous street in Bandung. It is part of Bandung old town established during Dutch occupation. As many building have been renovated  now it not so attractive anymore.
2015,Mobile128438,My htl is within Jln Braga so every day n nite i'll b passing thr.  Nothing much to review this plc. Thr are few eateries both local m western a few pubs n few convenient stores tht open 24hrs. The  road itself is busy with traffic n very narrow. Many empty premises but they
2015,d-vid16,Love the ambience Love the architectures Love the historical spot Definitely my favorite place in Bandung..
2015,haekal,Well this is the road I go by every morning and it's always crowded with people. Too bad the sidewalks has been renovated and it's always been messed up due to it not being finished. The traffic is bad cars parked inappropriately so are motorcycles being parked on the
2015,L0vespell,It's a nice walk along the street and capture the old building and architecture. See the art displays and enjoy a cuppa at one of the many cafes.
2015,GKWR,Need to very carefully when crossing the roads as the motorists does not give way to pedestrians even at the designated crossing. Walkways are not even and no safety signages or barriers are place when works are being carried. Most of the shops are selling painting and many
2015,tripthewiser,Jalan Braga and its offshoots are such a contrast from the rest of Bandung in terms of architecture layout and traffic flow. Parts of it are heavily reminiscent of parts of Melbourne and Cape Town due to the obvious Western influence.  Finish off the night by visiting the
2015,hweegink,We visited Jalan Braga in the afternoon. Many shops bars and restaurants were closed or empty. Some colonial buildings but nothing really impressive.
2015,tonysprings,Must visit with friends/wife/girlfriend. Lots of bars and restaurants to cater for all tastes and an excellent night out.
2015,misscherry6,This street is one of the most neat and clean street in Bandung. The pedestrian walk is very neat with so many chairs. You can just sit and watch people passing by take some pictures. There are some restaurants and cafe also. Overall I really love this street it's diffeent
2015,farahfatin,A lot of restaurant and bar. Near to bandung train station and pasar baru. Braga citywalk is there. U can check in at favehotel n aston hotel cuz both of them inside the mall. Very convenient.
2015,Sigitpramono,The braga street was very popular in Dutch era. The west java government trying do a lot to restore the street and make popular again. There are some festivals which organized by government. The braga festival is most festival event and tourits can see many traditional things
2015,smurfzzz,Night life area with some restaurant and cafes. Not as lively as phuket though but one of the best in Bandung.
2015,NiaA,For some people who have plan to visit Bandung and love being in lively place like me I would happily reccommend Braga street. In Braga there are many restaurants. Some serve beer and alcohol. You can find many restaurants that serve great steak too. Don't forget to go to Braga
2015,HanselHan,Small street with many small shops. The centre of urban growth of Bandung with many historical buildings. It is also the heart of art in modern Bandung with a good number of shops selling beautiful and relatively cheap art pieces. Good place for sightseeing and taking in the
2015,Gr64Oz,Jalan Braga is worth a visit.  Some nice restaurants along the street.  Its a little run down but you should definitely go there at least once
2015,AkiaD,I just love the restaurants that serve best quality foods and drinks. There is also an old restaurant there serving the grandma's cooked foods. Lovely.
2015,AshleyK,I love this place close to the Fave Hotel Braga its a delight Very french / Italian and pariesian in its flavours. There are bars and eating houses everywhere I loved the Lamp Posts and the round ship Ballast balls which line the streets. We have had some of the best food
2014,SaktiRMSitindaon,Its a great place to visit in a modern city. easy access for tranportation. its a street with an old buildings. There is so much food to explore. There is a mall too if you like to watch a movie or just mall-walking. There is a painting store. Good place to hunting for a good
2015,AdriantoGunawan,Should you willing to feel out the old Bandung.. this is the place you are worth to pay a visit. Better to have a overnight stays in this area then taste the local restaurant nearby.
2015,ArieM,1 of historical street in Bandung many old building near Asia-Africa conference historical building. good pedestrian many merchandise and souvenir store cafe restaurant.
2014,MdAryandi,A lot of very very very very very nice food outlets and bars and restaurants And not forgetting the street food vendore with their pushcarts. No regrets at all
2014,DanielAdhinugraha,Jl Braga is the centre of Banding shopping in the colonial era. Some shops & restaurants here still maintains the old charm but there were some new notable hotels & dining spots for every kind of traveller too.
2014,Anggi747,Most people come here to take a picture. Either with cell phone or professional camera. There's also a lot of bar/lounge restaurants and food stall. As a part of Bandung history Braga Street famous for its architectural legacy from Dutch colonial period.
2015,PipitIndriawati,+ Good place + full of memory + Heritage street + Old building + Culinary  - Traffic Jam - Improve the cleanliness of the street
2015,sitagliptin,....probably the best place to chill out at night and have a beer or even have a chat after some shopping...lotsa shops around and restaurants too...
2015,ItaL,I know Braga street is located in Bandung but it doesnt feel like you are in Bandung when you strolling down. Weather was perfect when im there and there are many historical building around! If you do want to take photos please have visit to this is street its worth it!
2015,chandras,Like the atmosphere at night. The street should be car and motorcycle free actually then people can really enjoy it.
2015,LiaJ,It's not a long street but quite famous and crowded. A happening area in Bandung with lots of restaurants. One of the streets in Bandung that actually have a pedestrian walk. You can find the old and the new. The old buildings the new ones the old restaurants cafes and
2015,juannetkl,find out more when you walk along the streets and you will be shock to see how peaceful these people from the different races share the harmony living under one roof
2015,RaduB,Nice restaurants and bars some better some less. Busy pace in the afternoon and night. Nice place to walk have a beer chat.
2015,Astrexis,this street have a lot history for Bandung. although many places has change into a new store/restaurant/hotel but the aura of this street is nice. thank God the sidewalk has been restored since last time I've been to Bandung so it become more comfortable to walk at night.
2015,ReinardK,Well i love the design and architecture and how well everything is organized here. I live in Jakarta and i confuse how Braga can be this cold with this much people shops and traffic. This place is really lively at night but not too quiet at the morning since it is full of
2015,adhisarak,Braga street is way much better now everything is nice and clean. Well paved and tidy remind me to old europen style street with old building soround it. So many chioces of bars and restaurant hotel also varied and one small mall completed with an XXI cinema. Braga will be
2014,DeybyLea,This street reminds me of streets abroad. Not like Venice but quitepeaceful and unique.  I like to walk there by night very nice lights.
2015,HenkyG,when you come to this street you will feel different atmosphere the street isn't asphalted but it is covered by grey tiles which makes it look classy and classical. on the pavement you can find painting vendors old buildings which blend with the new ones...such a work of art!
2015,Richard1948610,Really nice to dine in Jalan Braga and stroll past the artists and paintings on offer. Cool breeze in the evening make it a pleasant part of the city in the evening
2015,Paulina_Tan,Braga Permai is one of famous restaurant in Bandung. Night scenery around Braga is wonderful. A lot of people walk along the road with so many restaurant. Will visit Sumber Hidangan (old fashioned restaurant and bakery) next time when I visit Bandung. It is also famous but last
2015,doctorcalz,Braga street is a must place to visit in Bandung you can go hangout have your beer time lunch etc...
2015,shelynazhan,most of the place close down during night time. so braga street is the happening spot for tourist and local people during night time. there is nothing much there just restaurants pubs & cafe..
2015,IrsanO,They should not park their vehicle again on the street of Braga too crowded now..last time i went passed there ..few space of the street were occupied with cable installation and other. It is sad because Braga is a main road in Bandung with its history
2015,IjamZain,Like the variety of shops and outlet Dislike the beggars followingyoue around and wait while you are inside the shops later follow you back once you exot the TOKO
2015,Nurimani,the street full of painting art pictures you can see the beautiful drawing of them or you can buy one as a souvenir. there are also coffee houses so you can have a rest before going to another place to visit too
2015,BernardN,it becomes one of the local activities spot in the weekend especially at nights.  many local entertainments and events held in this area.  you can enjoy local food and friendliness.
2015,gilham63,In my honest opinion within this street has attraction by the old buildings. Those historical buildings give interesting point of view besides of lifestyle cafes and restaurants. Another interesting point about this street the young atmosphere at night many teens and young
2014,CelinaB,Drive through here and just take a look around I like this part of Bandung it's always colorful. The streets here are metropolitan and there are some good food halls
2015,JomelF,Jalan Braga or Braga Street is a very artistic place. The street is home to paintings for sale. Some are really good ones and are value for money. Once I saw lots of students sitting on the pavement with their painting drawing papers painting and drawing instruments painting
2015,Bioniacs,As a citizen maybe i'm already too familiar so i cant catch something special about the place. Recent international agenda asian african conference has driven the mayor to renovate the surroundings of braga and asia afrika street. A lot of art  deco building is restored and
2015,eiliyahtan,u can find some restaurant here n pub all with live band . this area full of young ppl  the chill out at night.
2015,andriagassi,Jalan Braga is a paved road surrounded by old-style buildings. There are a lot of cafes and bars on this street so it is a good place to hangout. Unfortunately the traffic is almost always busy.
2015,agusbudiman,one of bandung heritage..relaxing place while listening to acoustic live music (start at 7-10 pm) they offer western indonesian and some of heritage food. on of my favorite food here is nasi goreng special. you can also try western food such as beef cordon bleu with reasonable
2015,Gerald2463,Never seen so many young people in my life at one little place. We had been there soon after the 60th Asia Africa Conference and the place was open for the public after all the dignities had left. Really an awesome sight. Seems like a nice place to visit otherwise we were just
2015,NashMaxoriyapompuss,Seems like a very promising place to visit from the pictures you see online but it's nothing more than a street with sidewalks.  Bandung is a very disappointing city to visit.
2015,VRMajabavisdimi,Nice place to visit after dawn. Walk along the street enjoying the old buildings. I like the new street lights. Braga should be car free in the evening as to give people more space to enjoy it.
2015,MjD,currently along the Braga lane you can enjoy your filling about memorable nice clean and tidy road that had occur during Dutch collonial age long time ago. right now Braga have places to take time to enjoy those memories night living arts and also the place to relaxing your
2015,HansK,The old dutch buildings are around the road is made by stone blocks. If you drive or ride you need to park your vehicle just park your car in the shopping area mall in Braga street / Aston Hotel.  beware of traffic it's good to visit this place day & night since it has
2015,DanielP,This is one of the street that is still kept to the original heritage of Bandung of the past. This place is near the Asia-Africa Museum so it is a good stopping place when you are on your journey to this place.  I have been here quite often but I always have been during the
2014,Jean-MarcR,I have gone along Jalan Braga quite a few times but always in daytime. Maybe it's a good night spot but in daytime you will never get anything extraodinary there. Lots of art places but with repetition of styles. Lots of eating and drinking places but I did not find any
2015,WandeeRach,Roads are under contruction which was very hard to walk as u have to walk on the road itself and keep watching out whether vehicles are any way near to bang you . Bars are closed  most are local. Not really safe to walk
2015,DhayanDirgantara,A great location where you can find many historical dutch buildings. There are a lot of painting mini store restorant. I was enjoying my night exploring this busy street when I try to find a nice place for dinner. For you who are love exploring old town you have to try this
2015,Benyam,Cultural and historical heritage where you can find art vendors painting etc. Many building that from dutch colonial era. and braga city walk for place to hangouts.
2015,JohanKieft,coming back to what is used to be. 20 years ago Braga was a mere shadow of its famous past. Now it seem to be revamped an gaining new traction
2014,FrankV,Shopping is nice although there are many 'nyamuks' tourist flies. In the stores it is often possible to 'tawar' to bargain.
2015,KhairulbahrinN,saturday nite the best lots of ppl happening enjoying. feel safe low budget mid and high range hotel available at Braga. At least 4 convenience stores available easy access to Pasar Baru (need to walk less 1 km)
2015,RizaLSulaeman,You could find some art pieces along on the street beside some restaurants that could give you another experienced. Better walk from 1 end to the other end and back up to Aston hotel.
,monjunee,The street is not a really long street to walk. It was made of paving blocks to keep the authentic atmosphere there. There are many cafe and restaurants there. I recommend you to try the braga permai it is a very good restaurant but the best time to visit this restaurant is in
,HansSolo72,I don't think I can come up with more idiotic action even if I wanted to. The city is upgrading the both sides of sidewalk on Jalan Braga. Finally somebody cares for the pedestrians right? WRONG it's all in the name of 60th anniversary of the Asia Africa conference. And the
2014,JamesB,Talking about retro art and photos you have to go to this street. There are so many restaurants art shop with historical architectures all around the place. Can't say i'm satisfied went to this street but i'm not that disappointed too. Average tourism objects if you want
2015,Sophievg1982,There are a lot of restaurants on this street. All different kinds to choose from. As well as bars and clubs. All you need for a night out.
2015,MarionA,They are currently fixing the sidewalks.  What this means is that it's not only difficult to walk on those sidewalks (they stripped the old paving) it can be downright dangerous since there are many loose and/or broken tiles lying around (yes they plan to cover the
2015,ArshA,This is the original Bandung the downtown of Bandung city it's full of historic buidings from the colonial era there are wide variety of paintings shops unique cafes restaurants and hotels. The only thing that i don't like is the traffic jam but this place is deally worth
2015,HarsaS,Passing Jalan Braga feell something different. Many old building still original. Nice walking around Jalan Braga
2014,fabiolafirsa,Looking for an old traditional home made ice cream..really enjoy the the atmosphere of jalan Braga..
2015,pixiedub,If you enjoy art deco and colonial architecture Jalan Braga is definitely worth a stroll through.   There was a market that had a top floor full of antiques and vintage stuff which is also worth walking through if you like vintage. Didn't ask for prices though so am not sure
2015,BabaJ,Some good food here but otherwise I would not bother. This is a past it's prime type place. If you are into the bar scene there are several open air style bars here.
2014,HYJ10,Jalan Braga is the older settlement of the Bandung city. The architectures around the area have strong western colonial influence and some businesses occupying these old buildings take full advantage of the vintage feel by incorporating retro interior to enhance the ambiance.
2014,ReginaP,The street isn't for pedestrian. Cars and motorcycle are packed the street. The street is quite good with vintage atmosphere. I went to a culinary night there and food are everywhere. It's worth to visit.
2015,Tjoen,one location in memory of Bandung past  here there are restaurants Braga Permai famous  there are also several pubs  for those who want to taste the typical dishes of Sunda  you can slightly turn Cikapundung way  here there are food stalls where visitors can eat the dish
2015,M_A_Melissa,Must try this cullinary food. Its complete with noodle ribs Ceker Ayam and carrot. So delicious or in Indonesian we call it NAGIH LAGI.  Go there by taxi most of the taxi know this place
2015,santot,It was a famous street at the past an icon of glory old Bandung.  There were famous Cafe Bakery and restaurants prestigious shops jewellery shop Sarinah Department Store two Cinemas travel bureaus banks and amusement centres.  However because of miss-managed and
,JosephWong,Pavement under construction (as at Feb 2015) with uncovered manhole. Just a few restaurant & cafes line up in a 500 meters street with old buildings. Not a happening area.
2014,Andi,This classic street is the best place to enjoy the old city of Bandung. Good place for photo shoots. The street has long been planned to become a pedestrian but never realized. Thus the stone paveway has become useless since it is still heavily used by car traffic. Some never
2014,AfifahV,i always enjoy jalan braga as it sbone of heritage in bandung. The atmosphere was good unique place
2014,db9x,I love the ambiance sadly you should enjoy the traffic in busy hours. it should be get more attention from the government to make it more enjoyable for tourist. it would be a perfect place if there is no car or motorcycle allowed to pass this street. still wanna come back tho.
2014,fr4nc1sc4,I would prefer if the street is for pedestrian only. No car or motorcycle allowed. That could bring different deeper  atmosphere to the street... and bring out the best of what it is expected from the 'classic' street... where old settings of places to eat and hang out are
2014,SurfingWild,Braga should be one of the highlights of Bandung with it's paved street and historical buildings. But apart from a few stores art shops antique dealers Wimpy and a couple of very old cafes it seems run down. I think the Mayor of Bandung needs to give Jalan Braga a facelift
2015,Lovetravelkusuma,frankly speaking this area is really lively whether day or night you say..... very bright with full traffic one way flow just need to be carefull if need to cross the road. lots of eatries and 24hrs alfamart something like 7Eleven which is 24hrs... alone goes the pubs/clubs
2015,clairmontjeff,Classic architecture good for photographic enthusiasts. Many local restaurants serving local cuisine. In the evening several bars bustling with tourists.
2014,NanangF,When we went to this street just eat and shop because that way we go there. But this street is a quite popular in Bandung.
2015,PatchFamily,Jalan Braga buildings have nice architectures the Dutch used to live here in the olden time.  Now the strip is full with eateries and shops.
2014,TravelerO,Small mall on Jalan Braga there afew stores inside and some restaurants along with a cinema. Nothing special to see or do. Ok for a quick stop to eat but beyond that your time would best spent elsewhere in the city. The bigger malls are better such as Bandung Indah Plaza
2014,marthaulina,the mall is small & nothing interesting. if you want to go window shopping or just wasting time don't come to this mall. the cinema is ok.
2014,MilkaNoviatiB,Just a regular walk in the afternoon not fit for little children they get tired easily they're not too excited as we the parents to walk on the street
2014,mayda_poerwa,feel the atmosphere of colonial era at this street and you will find another side of Bandung. you can find a many stores and cafe enjoy old Bandung
2014,EltonH,Went there at night time. It was fantastic. There is a Polo Official Shop selling authentic t-shirts and shoes! Nice place to explore after running out of plans on where to go in Jl. Riau.
,CS_Tan289,The whole street was under constructio during my visit.   The dusk and smoke were horrendous.   This plave is overrated for now and should be avoided.
2014,Aaron_HeC,Number of pubs and clubs along the streets. but pretty dead at around 12am. Some restaurants and cafés here like sugarush and convenient stores. Police will be around at night to maintain order in case of nuisance drinking party-goers. Street is still under reconstruction and
2014,7Zebra,There were many restaurants ( Chinese Japanese Western Local  Fast Food art galleries retailsshops and a Braga City Walk Mall with many shops and a cinema.  But the pavements are now under construction so becareful while walking along the street as the traffic was heavy.
,RianaS,Jalan Braga is well known for its heritage. Where you could find old coffee shops along jalan Braga especially during weekend they also offer live music. They just wider the pedistrian path so it makes more convinience to have an evening walk.
2014,HardyY,the street is under rehabilitation along the way from the north side to the south one at daylight this brings crowded and traffic jam when rainy day comes pedestrian must be walk through carefully
2014,LIM640201,There is a souvenir shop opposite Aston Hotel which sell reasonably priced souvenirs. Note that 'Harga Pas' notice in this shop means fixed price.
2014,FrancisLee,I do not even know why this is a place to stay and see I was deceived into staying in this area! For goodness sake stay in the cihampelas area! It is made worse that the drainage work is currently being overhaul along this street! Walking here is hell! The cars and motorcycle
2014,JerryJCH,Braga is closer to Alun-Alun and if you want to visit a karaoke club there are some here just outside the Braga City Walk (Mall). There is also Braga Twenty One (Braga 21) a cinema on 2nd floor of the Mall.
,farizaziz77,Saw maybe a dying drug addicts on my night walk through the jalan braga.  Not so safe there to walk alone
2014,Yangtseguy,Where have they been? For sure not in Bandung or Braga. Bandung lost all flair and fascination it once got. No more sidewalks but open unsecured  holes combined with mud and dirt everywhere - not only in Braga. The Jakarta tourists jamming the city from friday to sunday to see
2014,ResintaN,I'm proudly review this street as a happy resident of Bandung. Jalan Braga is one of the interesting place  yet the humble one to visit in this city. It is basically one of the oldest street in Bandung that offers you culinary and entertaiment. One of my favorite. I prefer to
2014,BudiPrasetyo,Formerly Jalan Braga was interesting and romantic place but now at both sides of the road are undergoing construction it's difficult for pedestrian to walk along the road while the road is busy.  May be will be different if the undergoing construction is completed.
2014,TriSepdian,Nothing much to expect a street not too long less than 1km with a Paris vibe around. Yea its got some nice shops a clean sorrounding (for indonesia's street its still rare) but thats all. I still prefer to go to mall  or jalan dago or jalan riau for shopping.
2014,WendyTravel2012,We went there in the afternoon a few days ago.  This is a busy road.  In addition both sides of the road are undergoing reconstruction of the footpaths and it makes walking along the road rather difficult as you have to avoid the vehicles and motorcycles as you walk.
2014,L046,This one-way street has drainage construction along and looked like a cowboy street. It is surrounded by mainly restaurants and bars. At night it's packed with beggars young clubbers bar lovers. For shopping i only saw one poloraft shop at one corner.
2014,JenniferD,On the sections I travelled I found all the buildings to be old and dirty and in a great need of repair...it did not help with both sides of Jl Braga being dug up to install sewerage or storm culverts / drainage...all the earth works had been piled into the road leaving little
2014,DianneB,This area will be a major tourist spot in the future but at present is undergoing footpath works. I could see it as a mall closed off from vehicles in the future
