created_at,screen_name,text
2019,ChrisThomasTravels,Jalan Braga while not as storied as Jalan Asia Afrika has fared unfortunately similarly in the decades since its colonial past. While the historical architecture is interesting to look at the traffic hawkers and pollution are a constant distraction. I was disappointed in the
2019,Finds_posts,it is very messy and hot around here. whats left is the european style buildings in one of the main street in Bandung
2020,LinaRiswintaA,The historical street with Europe ambience along the street. It has so many cafes restos and bars to spend the time with friends or family..
2020,BarbaraR,We went at midday and had a nice meal at a Sundanese place. The street is full of restaurants and a few art shops with paintings but not much else. I was disappointed.
2019,MarineRamdhani,A City symbol first street in Bandung great place to hang out a lot of restaurant and cafe and bar but sad now the traffic to chaos but braga is braga still have to many story since colonial era
2020,LP0700,This is an interesting street filled with restaurants cafes traditional bakery and paintings. Remember to look up and admire the architecture. Feel like being transported to a different era.
2020,christinelovelyred,Braga City Walk is near other landmarks hence this is a good place for a Bandung City Tour.   Braga City walk is just walking distance from the Grand Mosque Aisa-Africa Conference Museum and the St. Peter Cathedral.   There are a lot of shops and restaurants along Braga
2019,paulinem,a place for adults to listen to live band and drink and dance. some paintings being sold and you can get your portrait drawn. some parts are dark and spooky at night
2020,blue_ring001,We are a frequent visitor to Braga having been here a few times. We usually stop for breakfast at Braga Permai because we enjoy local coffee and local yoghurt and watch people walk by. Another favorite stop is Rasa Bakery which provides a lot of varieties of bread and local
2019,MarvellHero,Situated at the heart of Bandung Braga Street offer stunning night activities with colonial old buildings especially at night time. Many restaurants and coffee shops are open at night time offer indulge food and lively night when spending time with the family. The only cons
2019,IWNoordergraaf,We my colleague and me walked through but had a hard time to cross over considering too much traffic cars motorcycles etc - which is very common in Indonesian cities but if city council would like to promote this street as a tourist attraction they should find a solution
2019,MaggieT,Definitely worth a stroll in the daytime for a sense of history from the Art Deco buildings and the bakeries. The historical bakery still has the old scales refrigerators and cash registers. It has not been 'renovated' so history leaps out at you. The pastries and sausage rolls
2019,Jblz,I don't know what people find interesting or special about this street. Its a slightly busy street with a few expensive restaurants. The buildings aren't that special so it's not really worth making a detour to Bandung to visit. Plus it's kinda close to a pretty sketchy area.
2019,CheowTeck,Hip street with bars and nightlife in Bandung. Great place to chill and take nice photos! With the conservation plans the old building facaded were kept in their original design conditions and this is a good job by the city.
2019,AmeliaC,I come here everytime I want to enjoy heritage buildings with new twist. There're lot of street food and cafes too.
2019,Widayatwahyu,A lot of place to have food in good restaurant .and the price is totaly cheap considering bandung is big city
2019,MuhammadR,It’s a pleasant walk right there.   We will hear several cafe with live music on the night. Bandung culinary is always good to be tasted. For the photographer there are so many spot that might provides you an authentic art.
2019,KonradM,What could be a pleasant relaxed street with outdoor focused cafes and restaurants is ruined with insanely busy traffic using the street as a major thoroughfare in Bandung. After not very long the traffic noise and petrol fumes get to you.  It would be easy to divert traffic to
2019,G2Kpauly,I walked down here the other day as I heard it was a famous street in Bandung with a reputation for prostitutes and etc. Well in the day time it was very low key didn't see one lol. Afew shops cafes bars restaurants. Really has nothing on Malioboro St in Yogokarta which is way
2019,Nicks,The best place for food. if you are like me who lazy to go outside finding another place to go. but for the traffic it is very bad traffic at any time.
2019,Aladin,The locals talk about this place like it is the main hotspot. But in reality its a small street with a lot of traffic thieves and criminals. Im talking about after sunset. There are not much options foor good food or a relax place to drink. This street has also a filthy
2019,Estguint,Visited Bandung for several times and always came to this area. I like this place you can see and experienced the heritage of Badung. Some old building give you the impression of the colonial heritage which is good. A Lot of restaurants stand surrounded this area. Recommend area
2019,TysonHorsewell,If you are travelling to Bandung you have to visit Braga street. I think foreign and Indonesians all come down for a visit and when I was there it was very busy (also it was the weekend). There are a number of entertainment places dotted around and on the street. I'll update on
2019,Susan188,Not quite what we expected .. too many pple .. too little too few not very eventful .. it is a street w small eateries a few restaurants .. the area is not well lighted certain parts seem to be in pitch darkness ..  We had our dinner inUpNormal a local cafe chain tt is a
2019,AndrewP,Braga has potential but appears to be well past its prime...slightly seedy nightlife ordinary restaurants and way too many bad paintings being sold on the street.  A bit of a refresh and a few better quality eating options would make a lot of difference.  Perhaps conversion to
2019,Seri06,The only thing that interest me here are the old colonials style buildings and the paintings displayed by the vendors along the street. Those caught my eyes and heart. Other than that the street are packed with youngsters hanging around at the many food joins available here.
2019,Meiiq,Never bored to visit Braga Street. Along the street you’ll find culinaries places such as cafe restaurant or beer house . My favourite place is a cafe with old truck serving table we order two cup of Hot Cappucinno. Starbuck Braga has Starbuck in the corner of Braga City
2019,FrankvanOdiel,This could be a nice street plenty of cosy bars and restaurants. But with the unstoppable stream of cars and motorbikes it's an unpleasant place to be. This should be a street free of traffic jam.
2019,goodname,A street with lots of food stalls cafes restaurants and snacks its a busy street with a mall aswell
2019,AstariM,We had our afternoon stroll in this area. It has some great cafes and bakery. Great area for experience old bandung and take a sip on local coffee.
2019,P.Saravanan,A very short street for bars pubs and night clubs to chill out especially weekends.  Good vibes creates if you hang out with a group of friends and with your tour guide. The ladies were so exuberant entertaining every clients with warmth hospitality.
2019,J.N,Braga street used to be like the 'Champs Elysees' of Paris or the 'Kalverstraat' of Amsterdam in the 1930-s. There are still quite a few old buildings and the city government has tried to revive that old charm over the past years with mixed results. There are some nice
2019,AgungW,Nice ambiance with the historical place inside of bandung city culinary & coffee shop are the main attraction in this street
2019,JohannesAdhi,This street was amazing back in old time but now it is very crowded road with crowded vehicle every where.
2018,dean-kafie,Roaming around Braga street has always been great experience. So many things can be freely explored. From vibrant and pretty street arts to various selections of delicate culinary joints.
2019,AvinashH,Good restaurants/pubs. The place is full of energy. Would be awesome if all the shops are open and new food scene added as few shops have been locked for years.  Cleanliness  and maintenance should be better! Overall a good place to have a good time.
2019,DewiAnggraini,Found it very interesting walking down this street. If you're from out of Bandung you have to visit this street. I really feel the Bandung's air here! Most of the buildings are old buildings. In the center of the Braga Street lined up a lot of cafes restaurants bars bakery
2019,Banu3009,Street is colorful and particularly lively in the evenings. Skip the malls and check out the coffee shops and paintings on the street. Beautiful!
2019,mostlyharmless,We walked down the street several times during the day - it gave the impression of a street that had forgotten it's past glories. Many shops were closed and/or poorly maintained and there was hardly any life around. The street was also continually congested with traffic. We
2019,Davie,Braga ... the name of the street where I and my childhood friends play first we always ran towards the city hall and through this road now the Braga street has become a modern one-way street and has become a night entertainment place in the city of Bandung
2019,sweetag,A place where i grew up ..many memories of restaurants .... shops ...though now its totally different but some memories cant just b forgotten .. the bakery where i got my 5th birthday cake is still standing with gallore .old building but still the same quality
2019,RiedhaMuh,We went there for the infamous Toko Kopi Djawa but we couldnt get a seat because it was saturday night and very busy coffee shop. We finally had our dinner to the store next to it.   Braga Street offers you different kind of ambience in comparison with any other parts of the
2019,RosalinaS,Braga Street counted as Bandung's Old Town area.It's a narrow street with old buildings on both sides of the street.Most of the time when people come to this area they will park their vehicles at one side of the street that make the street even get narrower that caused traffic
2018,MizSally24,I love to walk along this street. There a lot of little shops here selling paintings restaurants souvineers and other Indonesian nick nacks.
2019,andrew110,Life’s rich tapestry laid out for you. From Starbucks to hard rock bars with live music. You won’t be bored here
2019,TaherAlbaghliJulian,This is one of famous shopping area  in Bandung .We went to this street to see the shops .This street in busy it  is a small street in the center of Bandung There are no special to expect.
2019,Escape39369077582,There are various coffee shop restaurant pub n stores along way. Music playing everywhere. I call it the little Legian street (Bali). It would be better if the government block the access for cars n motorcycles to enter because as we walk along the street car honking the
2018,SurajPokhrel,This place ia rich in culture. People are really nice and food is awesome. The centro is awake 24/7.
2019,LeeLee,There is nothing much on this street to see except some eateries. This can be the place to have your meals
2019,JamesE,Been to Braga recently. This is the only lively area in Bandung for visitors. Old Fashion bars are found. Melas reasonably priced. Beer specials before 7 PM. Good to SIT Down and watch people.
2019,Global353400,nice spot for a take your moment at bandung you can find many place to chill or just to walk by in this area
2019,wyldfamilytravel,They tell you its famous because it once looked like a street from Paris but that must have been a long long time ago
2018,HardyS.TS.IP.M.H.,One of the streets in Bandung city which is filled with elements of art and culture in it. The streets are made of paving blocks sidewalks are filled with pedestrian benches and road corridors are often found by street artists such as painters musicians and sculptors. Crowded
2019,BudimanR,Among of the street you can find cafe restaurant bar pub billiard amusement and a lot of fun outlet. Such as braga city walk.
2019,DonnyH,Hang out at cafes and restaurants buy some paintings enjoy street musicians palying or just simply walk and look around and have fun.
2019,Kykypriandini,When you go to this place theres a lot of restaurant and cafe here.. You also can buy artworks like painting..
2019,ogiey,Nice place .. best for taking picture..ambience was really old fashion.  You can also hanging out. Many hotel here.
2018,tony12cu,One street full of eateries and bars.  A place to relax have a drink and perhaps listen to some live music.
2018,IingL,Braga street in Bandung is the most historical site thanked to Holland people which their country army occupied Indonesia for 350 years. So  Bandung in West Java lies so many constructions  houses  and street which were built by Dutch and became the legendary places  and
2018,CK_Ong8271,Places for the young and hip to hang out. has few nices cafe and road side art. The place became more alive in the evening compare to the afternoon
2018,Rindu4melayu,Good historical place down the memory lane to visit for fellow seniors like myself. Good place to take a walk and visit some old cafe serving good local cuisine.
2018,HrhH,Jalan Braga haa been around for more than a century.  It has historical buildings and one of the oldest bakery in Bandung.
2018,CiptoO,I passed and do a lot of activities in Braga and surrounding area mostly just to hang out. Beaga is so much different compare only to few years back. Traffic and parking are the worst part then come the pollution both noise and air. If I was the government I would restricted
2018,Iwan,You can see the historical bandung building along this street. Not to worry the street is narrow. So you will not take a lot of time to travel this street
2018,baguss,Jalan Braga is one of the favorite places in Bandung which has a variety of places or restaurants and coffee shops that live from 8pm to 12pm. can pamper tourists and those who like live music and hangouts with friends.
2018,BraucicB,Braga Street reminds me on Europe where all bars and galerys are. You can get some Art find Good food and in the night life music and enojing with locals.
2018,Javatriplus_tour,In the past Jalan Braga was famous for the elegance and luxury of shop stores along the way now a road that must be avoided because of the traffic jams and noise from the sound of bars and restaurants cars and motorbikes parked on the roadside making traffic jams worse.Also
2018,George7777,Good to visit to understand Bandung during the Dutch Colonial times.... few cafes and bakery are still open as during that time.  Suggest to visit at late afternoon to night-time for a better atmosphere and activities
2018,tjhinnora,The place is crowded with people who is just walking around or chillin at local bar.  A lot of bar resto and hotel here.  The place is photogenic like old town. If you take a pic here the result is awesome because the place is photogenic.  Near here there is a place to eat
2018,Climber825099,Braga a lane full of surprise! If you are first time here this route gives you full of surprise of nite life entertainment. All is parked around the street. From one door to another door its just a steps away. A night spend may not enough for you to experience it all!  Its
2018,Aniek70,Our first time in Bandung city centre plenty restaurant in Braga street from our experience none of them selling beer. The road in Braga street ( Bandung city centre) very crowded with traffic very difficult to cross the road even  when it's showing green man ( safe to
2018,SusanL,Good place to hang out with lots to browse around. Some shops of interest too. We ate some local food though there are many other western food stall like pizzas pasta doughnuts burgers etc.
2018,CahyoAdiN,You can say from Braga with love. Because you can walk selfie welfie just sit down or you can eat and drink delicious food in this place. If you come at afternoon until night you can enjoy how romantic of Braga street..
2018,aihaibara27,Had a short vacation on weekend. Booked a backpacker hotel in braga street. We dont have to worry about finding a restaurant. Braga street have a LOT of resto bar and food stall.
2017,DidikAchmadi,This area marks some historical sites of Bandung city. It came pretty much alive during the night as it has many restaurants and entertainment centre. Recommended place for taking photos walking or wandering around eat drink have some 'fun'.
2018,Saratiger,Remembering those old days at the time of independents. street made up as history till now good for walk around .
2018,VeryA,You can feel the Art Deco feeling here. You must try all the food along Braga Street unforgettable taste.
2018,BonniB,It's a famous place since 350 years ago it's a place where the royal family or dutch family spend their time and enjoying the java tea or coffee.   So many tourist attraction at this place such as an old book store or pastry hotels are easily could find at this place from 2
2018,FelisianiThanti,Doing night walking with my friends here and its feel nice and enjoyable. Many restaurants cafes and hotels makes this street a good place to hangout.
2018,yvonneian,Well I went to this place in the morning so I don’t find any lively activities here.  Maybe the place is lively at night.
2018,amazinggirls,this place is famous only for night. there is bar music etc but there is nothing there. if you only want disco here the place but more than that there is nothing interest. the traffic is crazy.
2018,Fionaleevemoa,I went to find a nice bar to have a Jack Daniels drink and relax. I ended up in Braga street where there are numerous bars. Some with live entertainment and some offering karaoke. I was there at 12am and found a nice place full of locals drinking and listening to good music.
2018,MariaWawa,Loving the ambience here its like Malioboro was having collaboration with Kuta. U can find coffee shop restaurant pub bar and shopping centre here. Live music!
2018,EdwardP,Having fun here with friend. Open till 3 hour. The real bar street in bandung!  For tourist really advisable to go to.
2018,SoloTravelgirl,It's pleasant to walk along the street while sightseeing on street art shops as well as local life surrounds. Other than that you can try dining in one restaurant or cafe but be mindful with the price since it may vary from one restaurant to another. There are times when the
2018,Kuru276,Braga Street is a major disappointment  especially Braga City Walk. This place to only comes alive at night with a few restaurants and bars there. There were a couple of outlets that had a live band playing. There's nothing to do there during the day. However  there are a
2018,FritsC,i used to visit Braga since i was a kid. now after 30 years I felt that Braga now looks to old and dirty. Perhaps the city government can consider to close down the road and make it only for pedestrian so we can enjoy it more.
2018,widyastutii,there are many available place to stop for coffee and food we stopped for cup of coffee we choose many coffee shop but as we are 50 people so not much available at that time. This place like no sleep at all... people are rounding here and there.
2018,MudofirH,Night live in bandung. Full with cafe and club. Hang out places with cold weather. Very crowd at night
2018,aryadifitra,holiday in Bandung city is not complete if you have not stopped by the road braga many available food centers vary with affordable prices .. enjoy the night on the road braga can also be made an option to enjoy the city atmosphere at night.
2018,SariN,The Braga Street is full of nostalgic building its old but yet warm walking down the street makes you smile along the way. Resto and cafe located by the street.
2018,riyadh,The street is very nice has everything coffee shop and restaurant and small stores. Nice for walking afternoon
2018,DerekY,a street with historical value. a street with plenty of character. the only problem is that it is rundown and needs restoration and repairs to bring it to its formal glory. buildings here are rundown and pathways are broken. chairs that lined the streets are mostly damaged and
2018,regm889,Plenty of restaurants and pubs nice for walks popular among locals but does not get much crowds early supposed to be a walking street but cars do not give a damn to cross - should be a priority tried dome veg noodles which was ok with few friends!
2018,Suria_Nataadmadja,I noticed that some efforts has been done to make this street to look better. The street itself looks okay but needs a lot of work on the pedestrian walkway which not properly built dirty not properly maintained. At the end of the street there’s a makeshift police station
2018,RobynQ26,Cafes and restaurants here are a little past their prime and the whole street felt tired and lacked a vibe. Some paintings for sale along the street but not much else to hold your attention.
2018,Lidvar,There is a lot of street sellers that sells paintings some good and some bad. Everyone is quite eager to sell to foreigners. Then there are some restaurants but the good ones in Bandung is not here.
2018,Thetimidtravel,A historical road. Very beautiful yet modern. Surrounded by cafes and hotels. This street is very lively at night. Pretty. That's it. And near to the Merdeka building.
2018,CahyadiPakeh,Braga needs a serious attention if they want to maximise exposing this old heritage street. Few attractive cafes were there. Small but complete supermarket was definitely helpful. But gallery needs to really well organised
2018,dr_alhalim,Good place for hang out if you go with young people. At night also you get a huge of foods and beverages at your convenient
2018,ElinaTeng,Not sure why the good reviews but we found it an average street with some nice buildings and shops. Okay to stay in a hotel here still one of the better places to be at.
2018,AliciaG,Braga reminds me of Bali in a bit. Love the people here the culinary and night life so much alive at night! Feels like in-between Bali and Thailand. The street itself has many variants of street food. You will find an unexpected places if you go to the alleyways. I love
2018,elacparl,The area feels like Pham Ngu Lao in Vietnam. Lots of artsy shops cafes and resto. I think this is the backpacker's street in Bandung.
2018,KokoS,This place maintains its original shape from the past. The building architecture along this street brings out the oldies memories.  Some of the dining outlets also serve meals from our grand parents. The taste is also very authentics.
2018,elmila,The street itself has many cafes and restaurants to offer. For shopping and running load rather the many side streets and alleys. You can spend a day here.
2018,muhadilelono,In Braga Street Bandung you can enjoy many ancient buildings that represent Europe's architecture design. This street have many commercial restaurants and entertainment function
2018,AuroraH,very good to hangout with friends at night. many kinds of cafe that we can choose with good food and beverage.
2018,MARTIJNSAMS,Nice area to walk around and see. Jalan makan is here too ! Must go! All the locale go here for Some food and entertainment
2018,JulianS,You have not yet visit Bandung if you haven't been to Braga street. It is historic as it is lively. If you're lucky the city held a festival from time to time here.
2018,LailaY,There are good places to eat & shop on Braga but it is another tourist-y place which is okay if you’re a tourist. I myself prefer to go where the locals go — it’s there that youll find the best food and the best entertainment. Just my opinion though.
2018,verahs,this street name has been so famous since i was young. If we have a goverment people like goverment in Singapore I am sure they will turn this place in such way like they did with Clarke Quay. I lived in Singapore once and i know what their goverment has done to uplift their
2018,AriK,Braga street is where we can still find the old looks of Bandung pedestrian where we can now some cafes and restaurants nowadays. Braga street is very alive at night where some foreigners spend sometime here just to relax and hang out. From Braga we can access the legendary
2018,dedimulyadir,Braga Street (official name in Indonesian: Jalan Braga) is a small street in the center of Bandung Indonesia which was famous in the 1920s as a promenade street. Chic cafes boutiques and restaurants with European ambiance along the street had made the city to attain the Paris
2018,User749251,I enjoyed walking and browsing the shops and restaurants. Parking is non-existant and I wouldnt recommend driving there unless very accustomed to the area.
2017,Chaty,I went to Braga in the middle of the night and to my surprise the street was still alive! We could find street vendors and grab some snacks. Don't forget to take pictures in front of some landmarks and famous street murals.
2017,hartonoj93,good place to walk around or looking for night life L:) once was full with massage parlor :)  just nice
2018,himalmandapjurneys,for party lovers and night crawlers this place is awesome in Bandung. lots of fun activities around. give it shot while bing there.  cheers !!
2018,endlesspampas,Great atmosphere nice buildings interesting places. Beer for sale (rarity in java). Go for just walking looking at people and places. It has a nasty side as well but u can stay out of it.
2018,Sychim,The title just about sums up the street. If you're looking for one or more of the three above this is the place to go to. Good mix of locals and tourists we had a nice dinner here.
